{
  "schemaVersion": "1.0",
  "kind": "receipt",
  "receiptId": "receipt-agent-contracts-foundation-001",
  "contract": {
    "contractId": "exec-agent-contracts-foundation-001",
    "revision": 1,
    "contractRef": "exec-agent-contracts-foundation-001@1",
    "issueUrl": "https://github.com/zaurakworks/agent-system/issues/2",
    "issueNumber": 2,
    "remoteVersion": "2026-08-16T14:04:17Z",
    "contentDigest": "sha256:2222222222222222222222222222222222222222222222222222222222222222"
  },
  "outcome": "delivered",
  "summary": "Delivered the project-local execution-contract foundation for maintainer review.",
  "artifacts": [
    {
      "name": "Draft pull request",
      "url": "https://github.com/zaurakworks/agent-system/pull/3",
      "commit": "0123456789abcdef0123456789abcdef01234567"
    }
  ],
  "verification": [
    {
      "command": "python contracts/tools/validate.py",
      "result": "Passed with all repository checks successful."
    }
  ],
  "globalWrites": [],
  "remainingUnknowns": [
    "Maintainer acceptance is pending."
  ],
  "submittedAt": "2026-08-16T17:00:00Z"
}
